{
  "$schema": "./custom-emoji-registry.schema.json",
  "schema_version": 1,
  "catalog_kind": "disabled_starter_template",
  "packs": [
    {
      "pack_id": "lucide_ui_adaptive",
      "telegram_set_name": null,
      "telegram_set_origin": "unpublished_template",
      "coherence_group": "lucide_ui_v1",
      "status": "template",
      "selection_priority": 100,
      "trust": "licensed_source",
      "source_kind": "licensed_source",
      "source_url": "https://github.com/lucide-icons/lucide",
      "source_revision": null,
      "license_spdx": "ISC",
      "license_url": "https://github.com/lucide-icons/lucide/blob/main/LICENSE",
      "notice_required": true,
      "redistribution": "allowed_with_notice",
      "allowed_roles": [
        "action",
        "navigation",
        "status",
        "category"
      ],
      "brand_safe": true,
      "needs_repainting": true,
      "style": {
        "family": "lucide_outline",
        "palette": "adaptive_monochrome",
        "line_weight": "regular",
        "detail": "low",
        "animation": "none",
        "mood": "calm",
        "density": "compact"
      }
    }
  ],
  "semantic_collision_groups": {
    "severity": [
      "warning",
      "error",
      "success"
    ],
    "commerce": [
      "payment",
      "refund",
      "free"
    ],
    "destructive": [
      "delete",
      "archive"
    ],
    "consent": [
      "consent",
      "success"
    ]
  },
  "emoji": [
    {
      "pack_id": "lucide_ui_adaptive",
      "token": "payment",
      "aliases": ["billing", "subscription", "renew"],
      "source_icon": "credit-card",
      "polarity": "neutral",
      "state": "default",
      "roles": ["action", "category"],
      "custom_emoji_id": null,
      "semantic_description": "payment or subscription action",
      "rich_text_alternative_emoji": null,
      "fallback_unicode": null,
      "needs_repainting": true,
      "enabled": false,
      "verified_at": null,
      "review_status": "awaiting_telegram_id"
    },
    {
      "pack_id": "lucide_ui_adaptive",
      "token": "profile",
      "aliases": ["account", "user"],
      "source_icon": "circle-user-round",
      "polarity": "neutral",
      "state": "default",
      "roles": ["action", "category"],
      "custom_emoji_id": null,
      "semantic_description": "user profile or account",
      "rich_text_alternative_emoji": null,
      "fallback_unicode": null,
      "needs_repainting": true,
      "enabled": false,
      "verified_at": null,
      "review_status": "awaiting_telegram_id"
    },
    {
      "pack_id": "lucide_ui_adaptive",
      "token": "servers",
      "aliases": ["hosts", "infrastructure"],
      "source_icon": "server",
      "polarity": "neutral",
      "state": "default",
      "roles": ["action", "category"],
      "custom_emoji_id": null,
      "semantic_description": "server or infrastructure list",
      "rich_text_alternative_emoji": null,
      "fallback_unicode": null,
      "needs_repainting": true,
      "enabled": false,
      "verified_at": null,
      "review_status": "awaiting_telegram_id"
    },
    {
      "pack_id": "lucide_ui_adaptive",
      "token": "support",
      "aliases": ["help", "contact"],
      "source_icon": "headset",
      "polarity": "neutral",
      "state": "default",
      "roles": ["action", "category"],
      "custom_emoji_id": null,
      "semantic_description": "support or help action",
      "rich_text_alternative_emoji": null,
      "fallback_unicode": null,
      "needs_repainting": true,
      "enabled": false,
      "verified_at": null,
      "review_status": "awaiting_telegram_id"
    },
    {
      "pack_id": "lucide_ui_adaptive",
      "token": "back",
      "aliases": ["previous"],
      "source_icon": "arrow-left",
      "polarity": "neutral",
      "state": "default",
      "roles": ["navigation"],
      "custom_emoji_id": null,
      "semantic_description": "navigate to the previous screen",
      "rich_text_alternative_emoji": null,
      "fallback_unicode": null,
      "needs_repainting": true,
      "enabled": false,
      "verified_at": null,
      "review_status": "awaiting_telegram_id"
    },
    {
      "pack_id": "lucide_ui_adaptive",
      "token": "warning",
      "aliases": ["caution", "risk"],
      "source_icon": "triangle-alert",
      "polarity": "warning",
      "state": "warning",
      "roles": ["status"],
      "custom_emoji_id": null,
      "semantic_description": "warning state",
      "rich_text_alternative_emoji": null,
      "fallback_unicode": null,
      "needs_repainting": true,
      "enabled": false,
      "verified_at": null,
      "review_status": "awaiting_telegram_id"
    },
    {
      "pack_id": "lucide_ui_adaptive",
      "token": "delete",
      "aliases": ["destroy", "remove-permanently"],
      "source_icon": "trash-2",
      "polarity": "destructive",
      "state": "default",
      "roles": ["action"],
      "custom_emoji_id": null,
      "semantic_description": "permanent deletion action",
      "rich_text_alternative_emoji": null,
      "fallback_unicode": null,
      "needs_repainting": true,
      "enabled": false,
      "verified_at": null,
      "review_status": "awaiting_telegram_id"
    },
    {
      "pack_id": "lucide_ui_adaptive",
      "token": "connect",
      "aliases": ["vpn-connect", "protected"],
      "source_icon": "shield-check",
      "polarity": "positive",
      "state": "ready",
      "roles": ["action", "status"],
      "custom_emoji_id": null,
      "semantic_description": "connect or protected state",
      "rich_text_alternative_emoji": null,
      "fallback_unicode": null,
      "needs_repainting": true,
      "enabled": false,
      "verified_at": null,
      "review_status": "awaiting_telegram_id"
    },
    {
      "pack_id": "lucide_ui_adaptive",
      "token": "devices",
      "aliases": ["device-list", "clients"],
      "source_icon": "monitor-smartphone",
      "polarity": "neutral",
      "state": "default",
      "roles": ["action", "category"],
      "custom_emoji_id": null,
      "semantic_description": "device or client list",
      "rich_text_alternative_emoji": null,
      "fallback_unicode": null,
      "needs_repainting": true,
      "enabled": false,
      "verified_at": null,
      "review_status": "awaiting_telegram_id"
    },
    {
      "pack_id": "lucide_ui_adaptive",
      "token": "locations",
      "aliases": ["regions", "countries"],
      "source_icon": "map-pin",
      "polarity": "neutral",
      "state": "default",
      "roles": ["action", "category"],
      "custom_emoji_id": null,
      "semantic_description": "server location or region",
      "rich_text_alternative_emoji": null,
      "fallback_unicode": null,
      "needs_repainting": true,
      "enabled": false,
      "verified_at": null,
      "review_status": "awaiting_telegram_id"
    },
    {
      "pack_id": "lucide_ui_adaptive",
      "token": "retry",
      "aliases": ["refresh", "try-again"],
      "source_icon": "rotate-cw",
      "polarity": "neutral",
      "state": "error-recovery",
      "roles": ["action"],
      "custom_emoji_id": null,
      "semantic_description": "retry a failed operation",
      "rich_text_alternative_emoji": null,
      "fallback_unicode": null,
      "needs_repainting": true,
      "enabled": false,
      "verified_at": null,
      "review_status": "awaiting_telegram_id"
    },
    {
      "pack_id": "lucide_ui_adaptive",
      "token": "settings",
      "aliases": ["preferences", "configuration"],
      "source_icon": "settings",
      "polarity": "neutral",
      "state": "default",
      "roles": ["action", "category"],
      "custom_emoji_id": null,
      "semantic_description": "settings or preferences",
      "rich_text_alternative_emoji": null,
      "fallback_unicode": null,
      "needs_repainting": true,
      "enabled": false,
      "verified_at": null,
      "review_status": "awaiting_telegram_id"
    },
    {
      "pack_id": "lucide_ui_adaptive",
      "token": "success",
      "aliases": ["complete", "done"],
      "source_icon": "circle-check",
      "polarity": "positive",
      "state": "success",
      "roles": ["status"],
      "custom_emoji_id": null,
      "semantic_description": "successful completion state",
      "rich_text_alternative_emoji": null,
      "fallback_unicode": null,
      "needs_repainting": true,
      "enabled": false,
      "verified_at": null,
      "review_status": "awaiting_telegram_id"
    },
    {
      "pack_id": "lucide_ui_adaptive",
      "token": "error",
      "aliases": ["failure", "failed"],
      "source_icon": "circle-x",
      "polarity": "negative",
      "state": "error",
      "roles": ["status"],
      "custom_emoji_id": null,
      "semantic_description": "error or failure state",
      "rich_text_alternative_emoji": null,
      "fallback_unicode": null,
      "needs_repainting": true,
      "enabled": false,
      "verified_at": null,
      "review_status": "awaiting_telegram_id"
    },
    {
      "pack_id": "lucide_ui_adaptive",
      "token": "home",
      "aliases": ["main-menu", "root"],
      "source_icon": "house",
      "polarity": "neutral",
      "state": "default",
      "roles": ["navigation"],
      "custom_emoji_id": null,
      "semantic_description": "navigate to the main screen",
      "rich_text_alternative_emoji": null,
      "fallback_unicode": null,
      "needs_repainting": true,
      "enabled": false,
      "verified_at": null,
      "review_status": "awaiting_telegram_id"
    }
  ]
}
